{
  "parent": "item/handheld",
  "textures": {
    "layer0": "astera:items/swords/falchion_v01"
  },
  "elements": [
    {
      "from": [7, 4, 7],
      "to": [9, 16, 9],
      "rotation": { "origin": [8, 8, 8], "axis": "y", "angle": 0 },
      "faces": {
        "north": { "uv": [0, 0, 2, 12], "texture": "#layer0" },
        "south": { "uv": [0, 0, 2, 12], "texture": "#layer0" },
        "east":  { "uv": [0, 0, 2, 12], "texture": "#layer0" },
        "west":  { "uv": [0, 0, 2, 12], "texture": "#layer0" },
        "up":    { "uv": [0, 0, 2, 2], "texture": "#layer0" },
        "down":  { "uv": [0, 0, 2, 2], "texture": "#layer0" }
      }
    },
    {
      "from": [5, 3, 7],
      "to": [11, 4, 9],
      "faces": {
        "north": { "uv": [0, 12, 6, 13], "texture": "#layer0" },
        "south": { "uv": [0, 12, 6, 13], "texture": "#layer0" },
        "east":  { "uv": [0, 12, 2, 13], "texture": "#layer0" },
        "west":  { "uv": [0, 12, 2, 13], "texture": "#layer0" },
        "up":    { "uv": [0, 12, 6, 14], "texture": "#layer0" },
        "down":  { "uv": [0, 12, 6, 14], "texture": "#layer0" }
      }
    },
    {
      "from": [7, 1, 7],
      "to": [9, 3, 9],
      "faces": {
        "north": { "uv": [2, 14, 4, 16], "texture": "#layer0" },
        "south": { "uv": [2, 14, 4, 16], "texture": "#layer0" },
        "east":  { "uv": [2, 14, 4, 16], "texture": "#layer0" },
        "west":  { "uv": [2, 14, 4, 16], "texture": "#layer0" },
        "up":    { "uv": [2, 14, 4, 16], "texture": "#layer0" },
        "down":  { "uv": [2, 14, 4, 16], "texture": "#layer0" }
      }
    },
    {
      "from": [6, 0, 6],
      "to": [10, 1, 10],
      "faces": {
        "north": { "uv": [4, 15, 8, 16], "texture": "#layer0" },
        "south": { "uv": [4, 15, 8, 16], "texture": "#layer0" },
        "east":  { "uv": [4, 15, 8, 16], "texture": "#layer0" },
        "west":  { "uv": [4, 15, 8, 16], "texture": "#layer0" },
        "up":    { "uv": [4, 12, 8, 16], "texture": "#layer0" },
        "down":  { "uv": [4, 12, 8, 16], "texture": "#layer0" }
      }
    }
  ],
  "display": {
    "thirdperson_righthand": {
      "rotation": [0, -90, 55],
      "translation": [0, 4, 0.5],
      "scale": [0.85, 0.85, 0.85]
    },
    "thirdperson_lefthand": {
      "rotation": [0, 90, -55],
      "translation": [0, 4, 0.5],
      "scale": [0.85, 0.85, 0.85]
    },
    "firstperson_righthand": {
      "rotation": [0, -90, 25],
      "translation": [1.13, 3.2, 1.13],
      "scale": [0.68, 0.68, 0.68]
    },
    "firstperson_lefthand": {
      "rotation": [0, 90, -25],
      "translation": [1.13, 3.2, 1.13],
      "scale": [0.68, 0.68, 0.68]
    },
    "ground": {
      "translation": [0, 2, 0],
      "scale": [0.5, 0.5, 0.5]
    },
    "gui": {
      "rotation": [0, 180, 0],
      "translation": [0, 0, 0],
      "scale": [1, 1, 1]
    },
    "fixed": {
      "rotation": [0, 180, 0],
      "scale": [1, 1, 1]
    }
  }
}
